article_number,Current_Turn,Previous_Turns,Type_of_Thought/Belief
499,"A: Even when things go right, I can't shake the feeling that I'm not qualified for my job.","A: I just completed a successful project at work, but... B: That's great, should be a confidence boost!",Intermediate Belief
500,"A: I always panic when my boss asks to speak with me, like I've done something wrong.","B: How was your day at work? A: Fine, but I have to talk to my boss tomorrow...",Automatic Thought
501,"A: Every time I make a mistake, I feel like I'm just not cut out for this job.","A: I messed up in the presentation today... B: It's okay to make mistakes sometimes, right?",Automatic Thought
502,"A: I just think that if I'm not constantly helping everyone, they'll start thinking I'm selfish or inconsiderate.",A: I've been so busy helping others with their tasks... B: Do you feel you're taking on too much?,Intermediate Belief
503,B: Maybe it’s not as bad as you think. Have you thought about alternative outcomes?,"A: Whenever I make a small mistake at work, I feel like it's the end of the world... B: Do you often feel that way when things don’t go as planned?",Automatic Thought
504,B: It sounds like you believe that you’re incapable of being loved.,A: I just don’t see why anyone would choose to stay with me... A: I don’t think I've ever felt truly wanted.,Core Belief
505,"A: It just slipped out, I always say the wrong thing at the wrong time!","A: I'm so embarrassed, I made a joke and nobody laughed... B: Maybe they just didn't hear you right?",Automatic Thought
506,"A: I feel like I'm a total disappointment, I can never meet my own standards.",A: I didn't get the promotion I worked hard for... B: Do you think this has affected how you view yourself overall?,Core Belief
507,"A: If I speak up in the meeting and say something wrong, everyone will think I'm incompetent.",A: I'm dreading this upcoming meeting... B: Have you thought about what you're going to say?,Automatic Thought
508,"A: It seems like if I'm not perfect, I've completely failed.","A: I had one error in my report and my boss noticed... B: But the rest of the report was excellent, wasn't it?",Intermediate Belief
509,A: I always mess things up. It's just who I am.,A: I can't believe I made that mistake at work... B: Everyone makes mistakes now and then.,Core Belief
510,"A: I just feel like something bad is going to happen today, even though everything was fine yesterday.","A: I slept so badly last night, I’m just so tired now... B: Are there any particular worries you have today?",Automatic Thought
511,I always mess things up when I'm under pressure.,"A: Lately, every time I face a deadline, I get so worried... B: Has there been a time when you've felt confident about meeting a deadline?",Automatic Thought
512,"I should be able to handle this; if I can't, then I'm worthless.","A: I have been given this project at work, and I'm stressing out... B: You've handled similar projects before, haven't you?",Intermediate Belief
513,"A: Every time I'm about to speak in a meeting, I become paralyzed thinking everyone will laugh at my ideas.",A: I'm really nervous about tomorrow's team meeting... B: Is it because you think your peers won't take you seriously?,Automatic Thought
514,"A: Deep down, I've always felt that I'm just not cut out for success, that I don't really deserve it.","A: Even after getting that promotion, why can't I shake this feeling of inadequacy? B: Do you often feel you're not deserving?",Core Belief
515,"A: I'm such a screwup, I always mess everything up.","A: I spilled coffee on the report I worked on all night... B: That's frustrating, it was an accident though, right?",Intermediate Belief
516,"A: I don't think I'll ever be successful, I just don't have what it takes.",A: I've been passed over for a promotion again... B: Is there anything you think might have contributed to that?,Core Belief
517,A: I feel like making a mistake means I’m not smart enough.,"A: I'm terrified of doing the presentation wrong... B: Everyone makes mistakes, it's normal.",Intermediate Belief
518,"A: It's too much, I feel overwhelmed and I'm convinced I can't handle my tasks.","A: There’s just so much to do right now at work... B: You've managed tough situations before, right?",Automatic Thought
519,"A: Every time I make a mistake, it proves I'm not clever enough.","A: I messed up the presentation today... B: Everyone makes mistakes, though.",Automatic Thought
520,B: Seems like you generalize a single error to mean you're inadequate overall.,"A: I forgot one answer during my interview, and now I feel like I'm totally incompetent... B: Is it just forgetting that question or is it a trend you've noticed?",Intermediate Belief
521,"A: I can't shake the feeling that if they don't laugh at my jokes, they don't like me as a person.","B: Did your friends enjoy the dinner party you hosted? A: They seemed to, but they found someone else's stories funnier than mine.",Automatic Thought
522,"A: If I make one more mistake at work, I’m sure they’re going to let me go.","B: You’ve been really stressed about work lately. A: Yes, I’ve been having a hard time keeping up.",Intermediate Belief
523,"A: Even when I'm on time, I feel like I'm always one step behind everyone else.","A: Traffic was terrible today, as usual I got to work late. B: But you left early, right?",Intermediate Belief
524,"A: Every time my phone rings, I assume it's bad news.","A: I get so anxious when I hear my phone, I can't ignore it. B: Has there been a lot of bad news lately?",Automatic Thought
525,"A: If I don’t succeed in this project, it will show I can never do anything right.",A: I feel like there's so much riding on getting this right... B: Is it based on past experiences where things didn't go as planned?,Intermediate Belief
526,A: Loving relationships are just not in the cards for me. I'm destined to be alone.,A: I had another date last night and it was another disaster... B: Do you often feel that things won’t work out for you in love?,Core Belief
527,"A: Whenever I get one thing wrong, it feels like everything is crashing down around me.","A: I just got some feedback on my work, and there was a mistake in it... B: Everyone makes mistakes, it's not the end of the world.",Automatic Thought
528,"A: I need to be the person who has all the answers, otherwise, I'm worthless.","A: I felt so embarrassed yesterday; I couldn't answer a question during the meeting... B: But it's normal not to know everything, right?",Intermediate Belief
529,A: I suppose that no one at work really values my input... they just see me as expendable.,"A: I've been at this job for years, but I still feel undervalued. B: Have you received any feedback from your managers?",Core Belief
530,"A: Life is always going to be a struggle, isn't it? It's like happiness is unattainable.",A: I've been dealing with so many problems one after the other. B: That sounds incredibly tough. Have things always been this way?,Core Belief
531,"A: Every time someone laughs in the office, I feel like they're laughing at me.",A: I just can't shake the feeling of being judged. B: How often do you get this feeling?,Automatic Thought
532,"A: If I don't finish this project perfectly, my career is over.",A: The deadline for the project is coming up and I'm really stressed. B: Do you think you've put in enough effort so far?,Intermediate Belief
533,"A: Whenever I'm at social events, I just freeze up and can't seem to say anything right.",A: I need to attend this networking event next week... B: Are you feeling nervous about it?,Automatic Thought
534,"A: I feel like if I make a mistake at work, my boss will think I'm incompetent.","A: There's this new project I've been assigned, and it's really intimidating... B: But you have a great track record with projects, right?",Intermediate Belief
535,A: Sometimes I feel like I'm a bad person and that's why I can't maintain long-lasting friendships.,A: I had another argument with my friend yesterday... B: Has it been happening often?,Core Belief
536,"A: I'm just inherently unlikable, which is why people always leave.",A: I don't have many friends left... B: Do you have any idea why that could be?,Core Belief
537,"A: Sometimes I feel like if I can't do something perfectly, it's a total failure.",A: I've been working on this project for weeks... B: But haven't you made a lot of progress?,Intermediate Belief
538,"A: I guess it's that when others don't agree with me, I feel they are judging me poorly.",A: I find it hard to speak up in meetings... B: Do you worry about what others think of your ideas?,Intermediate Belief
539,"A: If I can’t make everyone happy, then I’m a complete failure.",A: I just don't understand why my friends got upset when I suggested a different restaurant... B: Sounds like you were just offering a new option.,Intermediate Belief
540,"A: This always happens to me; I make one small mistake, and everything goes wrong.",A: I'm so frustrated because I miscalculated the budget for this month... B: Is there anything you can do to adjust it now?,Automatic Thought
541,"A: Every time I approach my manager, I feel like I’m going to be reprimanded. It's been this way at every job.","A: Work has been really stressful lately... B: Is it project related, or is it something else?",Intermediate Belief
542,"A: They didn't laugh at my joke, which proves I'm just not a likable person.","A: I don’t know why, but I feel like my friends don't enjoy my company... B: What led you to feel that way?",Core Belief
543,I always mess things up. I can never get it right.,A: I just spilled coffee on my report... B: That's unfortunate. It’s just a small mistake though.,Automatic Thought
544,Why try? I'm not smart enough to understand this.,A: Have you considered enrolling for the advanced course? B: I don’t think I have what it takes for it.,Core Belief
545,"A: I always screw things up, it’s just fact.",A: I received feedback on my report from my boss today... B: And? What did he say?,Automatic Thought
546,"A: Maybe I'm just not cut out for relationships, I always end up alone in the end.",A: My girlfriend and I broke up last week... B: That’s tough. Have you been able to figure out what went wrong?,Intermediate Belief
547,"A: Every time someone laughs nearby, I just assume they're laughing at me.",A: I feel so judged whenever I'm at a social gathering... B: Is there a particular reason you feel that way?,Automatic Thought
548,"A: If I'm not the most successful person in my group, I see myself as a total failure.",A: I always need to be the best at work… B: What happens when you're not?,Intermediate Belief
549,"A: Every single task I start, I see myself messing it up badly.",A: My work is really stress-inducing these days... B: What exactly makes you stressed about it?,Automatic Thought
550,"A: I feel like nobody cares about what I have to say, ever.","A: Even when I speak in meetings, it's as if I'm invisible... B: Have you felt ignored in other situations as well?",Core Belief
551,"A: If my coworkers don't approve my idea, it means they don't value my contributions.",A: I'm presenting a new project proposal at work today... B: Are you feeling confident about it?,Intermediate Belief
552,"A: Every time I see their pictures on social media, I just feel like my life is so boring.",A: I can't help but compare myself to others... B: What do you feel when you do that?,Automatic Thought
553,"B: If I don't get this job, it'll show I'm not skilled enough.",A: How do you feel about your interview? B: I'm really nervous.,Intermediate Belief
554,"A: Whenever I give a presentation, everyone must think I'm a joke.","A: I get so panicky speaking in front of colleagues. B: You seem to manage fine, what makes you think that?",Intermediate Belief
555,"A: I'm so clumsy and stupid, I never do anything right.","A: I spilled my coffee all over the reports during the meeting today... B: That was just an accident, everyone makes mistakes.",Automatic Thought
556,A: I don't think I'll ever be successful; I'm just not built for success.,"A: I applied for that promotion, but I didn't get it. B: Sorry to hear that. Do you think it might be just this one instance?",Core Belief
557,"A: When someone laughs nearby, I immediately think they're laughing at me.",A: It's hard for me to stay relaxed in social situations... B: Are you often concerned about how others perceive you?,Automatic Thought
558,A: I guess I've always felt that I'm just not lovable.,"A: Even as a child, I felt like I was on the outside... B: That sounds like it was quite isolating for you.",Core Belief
559,"A: If I don't perform well in this project, my team will think I'm not capable and I'll be overlooked for promotions.","A: I've got that big project review coming up... B: You’re the one who spearheaded it, right?",Intermediate Belief
560,"A: Every time I mess up, it just proves that I'm not cut out for this job.",A: I can never get these reports right... B: Isn't that an occasional mistake rather than the rule?,Intermediate Belief
561,A: I just feel so stupid when I make even the smallest mistake.,"A: Yesterday I accidentally sent an incorrect report to my boss... B: That could happen to anyone, did something else occur?",Automatic Thought
562,"A: Deep down, I know that I'm just fundamentally unacceptable to others.",A: I dread going to social events... B: Do you find it hard to connect with people?,Core Belief
563,A: Everyone always seems to exclude me from outings; I must be really unlikeable.,"A: I wasn't invited to the lunch again... B: Oh, that's rough. Have you tried reaching out?",Automatic Thought
564,A: Perfection is the only way I can be sure people respect me.,A: I've been working late every night to make sure every single detail is perfect... B: Sounds exhausting. Does it make you feel more respected?,Intermediate Belief
565,I always mess things up when I'm under any pressure.,"A: I can't believe I said that in the meeting today... B: It was just a minor slip, nobody took it badly.",Automatic Thought
566,Maybe I'm not meant to be in a managerial position.,"A: Every time I lead a project, there seems to be so much resistance... B: It's normal for teams to adapt to leadership styles over time.",Intermediate Belief
567,"B: I'm afraid to voice my opinion, because I'm convinced they will all judge me negatively.",A: Why don't you contribute to the discussions more often? B: I just feel like people won't take me seriously.,Core Belief
568,"B: Deep down, I'm certain I'm unlovable, and that's why I'll end up alone.","A: You seem a bit distant these days. Is something on your mind? B: It's hard to explain, but I've been feeling very isolated.",Core Belief
569,"A: It seems like everyone eventually leaves me, I must be fundamentally unlikable.",A: My last relationship ended abruptly... B: That sounds tough. Have many of your relationships ended that way?,Core Belief
570,A: I'm fairly certain I'm the one that people always talk about behind my back.,B: You seemed quiet in the meeting today. A: I get the feeling my coworkers don't really like me.,Core Belief
571,"A: Every time I make a mistake, it confirms I'm not smart.",A: I messed up the presentation today... B: Everyone makes mistakes now and then.,Intermediate Belief
572,A: They didn't reply to my message; they must think I'm not worth their time.,A: I tried reaching out to my colleagues... B: It takes time for some people to respond.,Automatic Thought
573,"I always feel like I'm the odd one out, like I just don't belong.",A: I just can't seem to mesh with the group. B: Have you felt like this in other groups as well?,Intermediate Belief
574,"I'm convinced I'm fundamentally unlovable, that's why I'm always single.","A: I haven't been on a date in over a year... B: That doesn’t mean you’re not lovable, you know?",Core Belief
575,"A: I'm just always awkward in social situations, it's like I can't help but say the wrong thing.","A: I don't really go out much, I never seem to enjoy parties. B: That sounds like you're uncomfortable in those settings.",Automatic Thought
576,"A: I can't believe I made such a stupid mistake, I should have known better.","A: I just had my performance review and it didn't go well. B: I'm sorry to hear that, what happened exactly?",Intermediate Belief
577,A: I can't shake the feeling that everything will go wrong if I'm in charge.,A: Work has been stressful with the new promotion. B: Isn't it a good thing to be promoted?,Automatic Thought
578,A: I guess I've always thought I had to be self-sufficient and can't count on anyone else.,A: I have difficulty asking for help... B: Did you have to fend for yourself a lot as a child?,Intermediate Belief
579,A: I always stumble over my words. I'm sure they'll think I'm incompetent.,A: I have to present my project in front of the whole team next week. B: You've always been thorough with your research.,Automatic Thought
580,"A: If I can't answer a question perfectly during the interview, they might reject me outright.","A: I've been studying nonstop for this interview. B: You're very knowledgeable in your field, aren't you?",Automatic Thought
581,A: I can never handle tasks under pressure. It's too much for me.,A: Deadlines always freak me out... B: Do you think that maybe you're putting too much pressure on yourself?,Intermediate Belief
582,"A: If I don't perform well in this project, I'm sure I'll be seen as incompetent by my team.","A: The last time I led a project, we missed a minor deadline... B: But you managed to deliver the project successfully in the end, right?",Intermediate Belief
583,"A: I just feel worthless, like nobody would ever want to be my friend or love me.",A: I've been really lonley lately... B: Have you tried reaching out to friends or meeting new people?,Core Belief
584,"A: Even when I succeed, I just don't feel competent. Deep down, I know I'm incapable.","A: I got the job, but I don't think I actually deserve it... B: Why would you say that? You worked so hard for this opportunity!",Core Belief
585,"A: I always mess things up. Just last week, I made such a blunder at work.",A: I've been really stressed at work lately... B: What happened that’s making you feel stressed?,Automatic Thought
586,A: No one at the party talked to me. They must think I'm boring.,A: I felt so awkward at the party last night... B: Did something in particular make you feel that way?,Automatic Thought
587,"I just know I'm somehow going to mess things up, even with everyone supporting me.",A: I've got the presentation next week and my team has been really encouraging... B: It sounds like you have a lot of support which is great!,Intermediate Belief
588,"I always feel like an outsider, like I'll never truly fit in anywhere.","A: I just moved to a new city and started a new job... B: That's a big change, how is settling in going for you?",Core Belief
589,"A: I feel like everyone at work is against me, they were whispering and I'm sure it was about me.",A: I’m so stressed out at work all the time... B: Are there specific incidents making you feel this way?,Automatic Thought
590,A: I clearly haven't performed well enough; my boss didn't even acknowledge my work.,A: I spent all week working overtime on that project... B: And what happened when you presented it?,Intermediate Belief
591,A: I just feel like everyone is always judging me whenever I speak up.,A: Presenting in meetings always makes me nervous... B: Have you received any negative feedback on your presentations?,Core Belief
592,"A: Things always seem to go wrong, it's like I'm destined to fail.","A: I worked really hard on that project, but it was still criticized... B: Do you think it was criticized fairly?",Core Belief
593,"A: Every time I start a new project, I immediately think it's going to be a disaster.",A: Managing new projects comes with such stress... B: How do you usually feel when a project begins?,Automatic Thought
594,A: I obviously didn't get invited because they don't like having me around.,A: I noticed I was the only one from our group not invited to the event... B: Have they mentioned why they didn't invite you?,Intermediate Belief
595,A: I feel like I'll never be happy again.,"A: My girlfriend broke up with me last week and I've been miserable... B: Breakups are tough, but they can be a start of something new.",Core Belief
596,"A: No matter how hard I try, I always seem to mess things up.","A: Just got my performance review, it wasn't great... B: Do you think you could have done something differently?",Core Belief
597,"A: Even when I do things perfectly, I feel like it's never enough to be recognized.",A: I've been at this job for five years now... B: You've accomplished a lot in that time.,Intermediate Belief
598,"A: Every time something goes wrong, I just automatically think it's my fault.",A: I'm really upset about the project outcome... B: Weren't there unforeseen issues that contributed to this?,Automatic Thought
599,A: Sometimes I feel like a total failure and that I'll never amount to anything.,A: I just got passed up for that promotion again... B: I'm so sorry to hear that. Have you considered asking for feedback?,Automatic Thought
600,"A: I'm convinced I'm inherently unlovable, and I'll always be alone.",A: Yet another relationship ended... B: Do you want to talk about what happened?,Core Belief
601,"A: Whenever someone critiques my work, I feel absolutely crushed. It's like I'm always the one making mistakes.",A: I've been struggling at work lately. B: Has someone been giving you a hard time?,Automatic Thought
602,A: I don't know why I bother trying. I'm just inherently unlikable.,"A: I went to that social gathering last night... B: Oh, how did it go?",Core Belief
603,"A: I feel like anytime someone doesn't reply to my message, they're ignoring me on purpose.","A: Yesterday, I messaged my friend, and she didn't respond till today... B: Maybe she was just busy?",Automatic Thought
604,"A: No matter how hard I work, someone else is always better.","A: I'm just tired of trying so hard at work... B: Your last project was a huge success, though!",Intermediate Belief
605,"A: Whenever someone criticizes me, even slightly, I just collapse inside and can't get over it.",A: I received some feedback at work and it wasn't all positive ... B: Was the feedback constructive?,Intermediate Belief
606,A: I missed one deadline and now I feel like I am the most irresponsible person on the team.,"A: Work has been stressful lately... B: One setback doesn’t define your whole work ethic, you know?",Automatic Thought
607,A: I can feel my heart racing and it means I'm about to have a panic attack.,"A: Every time before a presentation, I start to sweat... B: Are you nervous because you're worried about the reaction?",Automatic Thought
608,A: I just know they're all going to laugh at me when I step into the room.,A: I am dreading the party on the weekend... B: How come you're feeling that way?,Automatic Thought
609,A: I'm never chosen for projects at work because I'm not smart enough.,A: I've been getting passed over for assignments lately...                         B: Have you talked to your manager about this?,Automatic Thought
610,A: I feel like I will always be alone because no one truly likes me for who I am.,A: Another date didn't go well again...                                 B: Do you think perhaps it was just not a great match?,Core Belief
611,"A: Every time I'm in a social situation, I just freeze up and can't function.","A: Lately, I've been avoiding parties and social gatherings... B: Is it because you're feeling self-conscious in those settings?",Automatic Thought
612,"A: If I don't perform perfectly on this project, my career is over.",A: I've been so stressed at work because there's a lot riding on this project... B: Isn't there some room for learning and growth?,Intermediate Belief
613,A: I am always alone because nobody truly likes me.,"A: Recently, I find that I don't have many friends to call or hang out with... B: Have you tried reaching out to someone?",Core Belief
614,A: I feel worthless; I'm just not capable of being successful like others.,"A: No matter how hard I try, it seems like I never accomplish my goals... B: Sounds like you’ve been dealing with a lot of setbacks.",Core Belief
615,"A: Life just always seems to knock me down, like I'm just meant to be a loser.","A: Just when things start to look up, something bad happens... B: It sounds like you're feeling quite hopeless.",Core Belief
616,"A: Even when I'm surrounded by people, I feel isolated like I just fundamentally don't belong anywhere.","A: I try to socialize and be a part of things, but... B: Do you feel disconnected during those times?",Core Belief
617,"A: Whenever someone laughs nearby, I immediately think they’re laughing at me.",A: I feel so awkward in social settings... B: Are people giving you a hard time?,Automatic Thought
618,A: I feel like life is always going to be a struggle and there's no point in hoping.,A: I've lost my job and I'm having trouble finding a new one... B: That sounds incredibly difficult; have you tried reaching out for more support?,Intermediate Belief
619,"A: I can't relax. As soon as I sit down, I feel like I should be doing something productive.",A: I've been so busy lately... B: It's important to find time to relax too.,Automatic Thought
620,A: Nobody really understands the effort I put into my work. I feel like I'm always judged unfairly.,"A: I work so hard, but my manager rarely acknowledges it. B: Do you feel recognized by your coworkers at least?",Intermediate Belief
621,A: I'm such a disappointment to everyone; it's just who I am and I can't change it.,"A: I tried speaking up in the meeting today, but I stuttered and paused too many times... B: It sounds like it was a challenging moment, but everyone has those, right?",Core Belief
