article_number,Current_Turn,Previous_Turns,Type_of_Thought/Belief
249,A: Everyone laughs whenever I speak up in meetings. I shouldn't say anything at all.,A: I just don't feel like part of the team... B: Have you tried sharing your ideas more often?,Automatic Thought
250,"A: If I can't get this job, then it just proves I'm incapable and always will be.","A: This is my fifth interview this month... B: That's tough but keep in mind, job hunting is hard for everyone.",Automatic Thought
251,"Every time someone disagrees with me, I feel they instantly hate me.","A: I had another argument with my coworker today. B: What happened? A: I presented my idea, but he said it wouldn't work.",Automatic Thought
252,I should always be able to handle things on my own.,"A: You seem overwhelmed, can I help? B: No, I need to figure this out by myself. A: Isn't it okay to ask for help sometimes?",Intermediate Belief
253,"A: Sometimes I feel like I don't belong anywhere, like I'm always on the outside looking in.",A: I just can't shake the feeling of loneliness... B: That sounds like it's really affecting you.,Core Belief
254,"B: So, when they said that, did it make you feel even less confident?","A: Every time I express my opinion at work, I get shut down. B: That must be frustrating.",Automatic Thought
255,A: If I can't learn this then I must be stupid.,"B: Have you tried the tutorial for the new software? A: I tried, but it's just so hard to understand.",Intermediate Belief
256,"A: I feel like everyone just tolerates me, deep down they must find me so boring.","A: I don't know why, but I always feel left out at social events. B: Do you feel like people aren't engaging with you?",Core Belief
257,I always mess things up whenever it's important.,A: My presentation didn't go well at all. B: This is the second time you've said that about a presentation. What happened?,Automatic Thought
258,"Every time someone criticizes me, I just feel so stupid and worthless.",A: My boss pointed out an error in my report today. B: How did that make you feel?,Automatic Thought
259,"A: When things go wrong, it's usually because I can't do anything right.","A: I just heard I didn't get the promotion at work again... B: That's tough, do you know why they might have passed you over?",Automatic Thought
260,"A: I feel that if I'm not perfect, I am a complete failure.",A: I can't stop stressing over this mistake I made last week... B: Everyone makes mistakes sometimes.,Intermediate Belief
261,"A: I'm convinced that if I make one small mistake, everyone will think I'm incompetent.",A: I'm worried about giving that presentation next week... B: You're always so detailed in your preparation.,Core Belief
262,"A: It feels like I've always thought I'm unlovable, which is why relationships are so hard for me.",A: My dating life has been a series of disappointments... B: That sounds hard. Have you ever wondered why?,Core Belief
263,"A: Every time I make a small mistake, I feel like my colleagues think I'm incompetent.",A: I've been under a lot of stress at work lately... B: Is it because you've been tasked with more responsibilities recently?,Automatic Thought
264,"A: Deep down, I believe that if someone gets to know the real me, they won't like what they see.",A: I have a hard time opening up to people... B: Does it feel risky to show your true self?,Core Belief
265,I always mess things up with my friends.,A: I'm worried they'll stop inviting me to hang out... B: Why would they do that?,Automatic Thought
266,No one ever listens to what I have to say.,A: They just cut me off mid-sentence... B: Have they done it more than once?,Intermediate Belief
267,A: I'm such a failure; I always mess things up.,A: I screwed up the presentation today... B: Was it really that bad or are you being a bit tough on yourself?,Core Belief
268,"A: It feels like I'll always be alone, that nobody could really love me.","A: My relationship just ended, and it's consuming me... B: Breakups are hard, are you okay?",Core Belief
269,"A: Even when my friends compliment me, it feels like they're just saying it out of pity.","A: No one ever notices my work... B: But everyone complimented your last project, I remember.",Intermediate Belief
270,"A: I just don't feel like I can ever be happy, no matter what people say to help me.",A: I'm always down these days. B: But there is so much in your life to be happy about!,Core Belief
271,"A: Every time someone criticizes me, I just crumble inside.",A: I received some feedback today at work. B: Was it constructive feedback?,Automatic Thought
272,"A: If I don't perform perfectly on this task, my colleagues will think less of me.",A: I have this important task that I'm responsible for at my job. B: Are you worried about how it will go?,Intermediate Belief
273,"A: Sometimes I think I should just give up, the chances of me succeeding are nonexistent.",A: I've never been good at public speaking... B: But haven't you been practicing your speech?,Automatic Thought
274,"A: I don't know, it's like I'm programmed to mess up relationships.","A: I am really worried I behaved awkwardly during the date. B: Even if you were a bit nervous, it's totally normal on a first date.",Intermediate Belief
275,"A: I guess it doesn't matter what they say, I just always think that they're judging me.","A: Every time I walk into the room, I feel like everyone is staring... B: But you said they were nice to you, right?",Automatic Thought
276,"A: No matter how many times I succeed, it feels like I'm just one mistake away from being a total failure.","A: I just got praise for my project, but... B: That's great! You should be proud of your work.",Core Belief
277,"A: Every time my phone rings, I feel like it's going to be bad news.",A: I've started to dread phone calls... B: Have there been many difficult calls lately?,Automatic Thought
278,"A: If I can't handle this task at work, then I'm just worthless as an employee.",A: I've been given a challenging project at work... B: Sounds like it's a big responsibility. Do you feel up for it?,Intermediate Belief
279,"A: Every time someone looks at me strangely, I can't shake the feeling that they're judging me.",A: I just feel so awkward at social events... B: What makes you feel that way when you're around people?,Automatic Thought
280,"A: I guess at the end of the day, I just feel like I'm not worthy of love.",A: All my relationships seem to fail... B: Why do you think you feel that way about your relationships?,Core Belief
281,A: I feel so stupid every time I open my mouth.,A: I'm dreading the presentation next week... B: What's got you worried about it?,Automatic Thought
282,A: I can't trust anyone; they always end up betraying me.,A: I've been backstabbed by friends before... B: It sounds like those experiences really hurt you.,Core Belief
283,"A: Every time I start a new project, I end up thinking that it's just going to be another disappointment.",A: I never seem to get things right. B: Haven’t some of your projects been successful in the past?,Automatic Thought
284,A: I feel overwhelmed; I'll screw it up because I'm not smart enough and everybody will notice.,A: There's a major presentation I need to give next week. B: You're always so thorough with your work.,Automatic Thought
285,"A: Deep down, I feel like I'm just completely worthless and not deserving of love.",A: I've been struggling to maintain my relationships... B: That sounds challenging - do you feel like you're not good enough?,Core Belief
286,A: I must be perfect in everything I do; that's the only way anyone would respect me.,A: I stayed up all night to get this report perfect. B: Is it that important to get it perfect?,Core Belief
287,"A: Whenever I'm in social situations, I just freeze up. I can't think of anything to say, and it's so embarrassing.",A: I've always been kind of shy... B: You feel uncomfortable talking with new people?,Automatic Thought
288,"A: Maybe I've always assumed that if I'm not perfect, I've failed. Anything less than perfect is unacceptable.","A: I got a B on my exam, and I can't stop thinking about it... B: But that's a good grade, isn't it?",Intermediate Belief
289,"A: Every time my phone rings, I panic, thinking it's bad news.",B: How do you feel when you receive phone calls? A: I usually get anxious and can't help but assume the worst.,Automatic Thought
290,A: I just feel like I need to be in control of every situation or else everything will go wrong.,"B: It seems like you find it hard to relax. A: I always need to manage everything. Otherwise, I'm afraid things will fall apart.",Intermediate Belief
291,"A: I'm convinced I'm going to mess up this project, just like everything else in my life.","A: I just can't seem to get anything right at work. B: You're being a bit hard on yourself, don't you think?",Core Belief
292,"A: No matter how hard I try, I never live up to my own standards.","A: Even after working overtime, my report wasn't perfect. B: But you did put in a lot of effort and got it done on time.",Core Belief
293,A: I guess I'm just not the kind of person who can be happy.,A: Seems like everyone else has their life together except for me... B: That sounds quite tough to deal with regularly.,Intermediate Belief
294,"A: Whenever I get feedback, I immediately think it means I've done a terrible job.",B: Tell me more about how you feel when you're evaluated at work? A: It's stressful because I always assume they're not happy with my performance.,Automatic Thought
295,A: Everyone seems to be getting ahead of me; I must be doing something wrong.,A: I try so hard at work and yet... B: What's been happening?,Intermediate Belief
296,"A: I'm such a failure, I mess up everything I touch.",A: Yet another relationship has ended for me... B: Do you think there's a pattern?,Core Belief
297,A: I feel like if I don't get this job then I'll never be successful.,"A: I've been job searching for months now... B: And there's a good chance with this next interview, right?",Intermediate Belief
298,B: Maybe you are right; maybe it's not about being perfect but more about feeling like I made a good contribution.,"A: Your work has really helped the team, don't you think that counts for something? B: I guess, but unless it's perfect, I feel like it's not enough.",Intermediate Belief
299,A: Sometimes I feel like making a single mistake will ruin everything I've worked for.,A: This project is really important to my career... B: You've been doing really well so far.,Automatic Thought
300,"A: I always mess things up in my relationships, I guess I'm just not meant to be with someone.",A: Another date went poorly yesterday... B: Do you think maybe you're being too hard on yourself?,Automatic Thought
301,"A: I always end up alone at these events, because I am not interesting to talk to.","A: Everytime I go to social gatherings, I feel so awkward... B: Do people there make you feel unwelcome?",Core Belief
302,A: I’m convinced I’ll mess it up; I’m just not competent like everyone else.,A: I've got this big project coming up at work and I'm dreading it... B: But you've always been thorough and prepared.,Core Belief
303,"A: If I don't get this job, it's proof I'll never amount to anything.","A: I've sent out dozens of job applications, and no responses... B: That's tough, but it may just be bad timing, not necessarily about you.",Intermediate Belief
304,A: I'm always the last one to catch on to new things at work. Maybe I'm just not cut out for this job.,"A: These new software updates are tricky... B: Yeah, it takes a while to get used to changes, especially complex ones.",Intermediate Belief
305,A: Every time my phone rings I'm convinced it's going to be bad news.,A: I've been so jumpy lately... B: Are you worrying about something specific?,Automatic Thought
306,"A: I feel like if I can't succeed at this, then I'm just a complete failure.",A: I'm under a lot of stress with this project right now. B: It's important to remember that your worth isn't defined by one project.,Intermediate Belief
307,A: I'm just worthless and there's no point in trying to do better at work.,A: They didn't include me in the project again... B: Have you discussed your role with your supervisor?,Core Belief
308,"A: If I don't get this job, it means I'm not skilled enough and probably will never be.",A: I'm nervous about the interview today... B: You have a lot of experience and skills that are relevant.,Intermediate Belief
309,"B: Maybe if I just got more sleep, I wouldn't feel so terrible all the time.","A: You’ve been looking quite tired lately... B: I just feel exhausted, no matter what I do.",Automatic Thought
310,"A: I'm always the one who has to reach out, they probably just tolerate me.",A: I noticed I'm always initiating plans with my friends... B: How does that make you feel?,Intermediate Belief
311,"A: Every time someone critiques my work, it feels as if I'm just not cut out for this job.","A: I put all my effort into that project and yet, my manager found a bunch of errors... B: Sounds like that was really discouraging.",Automatic Thought
312,"A: Maybe if I were smarter, I wouldn't be in this mess.","A: I just got my exam results, and they're terrible... B: Did you study for it?",Intermediate Belief
313,"B: Whenever I get involved in a group project, I feel like the others are not satisfied with my input.",A: You've voiced that group work makes you anxious... How so? B: It's just that sometimes I think I'm not contributing enough.,Intermediate Belief
314,"B: Every time I make a small mistake at work, I start believing I might get fired.",A: You seemed upset after that little error yesterday. B: It just hit me really hard; I can't shake off the feeling.,Intermediate Belief
315,"A: I always mess up relationships, I guess I'm just not cut out for love.",A: Another date that didn't work out... B: What happened this time?,Intermediate Belief
316,"A: Every time I see feedback, I immediately think it's going to be negative.",A: I submitted my report yesterday... B: Are you worried about the feedback?,Automatic Thought
317,A: I just messed up again. I'll never get this right.,A: Practiced the speech multiple times... B: Seems like you've put in a lot of work.,Automatic Thought
318,"A: Deep down, I feel unlovable, like there's something fundamentally wrong with me.","A: Even when someone is nice to me, I distrust it... B: Why do you think that is?",Core Belief
319,"A: Every time I speak up in a meeting, I just know people find me annoying.",A: I really don't like meetings at work... B: What specifically about them bothers you?,Automatic Thought
320,"A: If I don't excel in this project, it proves I'm not cut out for this job.",A: I have a major project due next week... B: It sounds like you're putting a lot of pressure on yourself.,Intermediate Belief
321,"A: I just feel worthless, like I'm not meant to be happy.",A: I've been so down lately... B: Is there something in particular that's been bothering you?,Core Belief
322,A: I must be incapable of making good decisions because things never work out.,A: Another relationship ended badly... B: Do you feel like there's a pattern in how they end?,Core Belief
323,"A: Every time my phone rings, I assume it's bad news.",A: I've been very jumpy lately... B: Can you tell me more about what triggers that feeling?,Automatic Thought
324,A: I just messed up a minor thing at work and now I feel completely useless.,"B: Tell me about your day. A: It started off well, until I made a small mistake on a document.",Automatic Thought
325,"Every time I start a new project, I instantly feel like it’s going to be a disaster.","A: This new assignment is really challenging... B: But you’ve handled similar tasks before, right?",Automatic Thought
326,"I feel like if I don't ace this exam, I am a total failure.",A: I am really worried about my upcoming exam. B: Have you been studying?,Automatic Thought
327,"A: If I don't perform well, everyone will think I'm incompetent.",A: I'm really worried about this presentation. B: What specifically worries you about it?,Intermediate Belief
328,"A: I guess at my core, I've always felt like I'm not enough.",A: I always push myself to do more and be better. B: How does that make you feel on the inside?,Core Belief
329,A: Everyone seems to get this except for me. I must be really stupid.,"A: I'm struggling to understand this concept in class... B: It's okay, a lot of people get it at different times.",Automatic Thought
330,A: I always have this feeling that I will be alone because I'm fundamentally unlovable.,A: Another relationship ended badly... B: Do you feel like it’s a pattern?,Core Belief
331,B: I'm just a failure who can't do anything right.,A: This was just one project. You'll have more chances... B: But this always happens to me.,Intermediate Belief
332,B: I'm convinced I'm a bad friend; no one actually likes spending time with me.,A: You seemed upset that not many people came to your party. B: It just confirms that I don't really matter to anyone.,Core Belief
333,"A: Every time my boss calls me, I just know it's because I did something wrong.",A: I get so nervous when I see my boss's number on my phone. B: Has he been calling often?,Automatic Thought
334,"A: I just think if I can't do this perfectly, it means I'm completely inadequate.","A: I've been working on this project for weeks and it’s still not right. B: Perfection is tough to achieve, you know?",Intermediate Belief
335,I can't seem to maintain any of my friendships. I suppose I'm just not interesting enough to keep people around.,"A: Lately, everyone seems busy when I ask to hang out... B: That's tough. Have you spoken to any of them about how you feel?",Intermediate Belief
336,I always end up alone because I'm inherently unlovable.,"A: I don't get why every relationship I have falls apart. B: Do you think there might be patterns in your behavior, or ways you interact that contribute?",Core Belief
337,"A: It's just impossible to succeed in this industry, I see others doing well but somewhere I think I'm not cut out for it.",A: I've been trying so hard to get my business to take off... B: What seems to be the primary obstacle you're facing?,Core Belief
338,"A: I always end up alone, it seems like people always leave me eventually.",A: I recently went through a tough breakup... B: That sounds difficult. Have you felt this way in other relationships as well?,Core Belief
339,A: I can never get things right; it's like I'm programmed to mess up.,"A: I made a mistake at work today... B: Everyone makes mistakes sometimes, don't be too hard on yourself.",Automatic Thought
340,"A: Deep down, I know I'm just a failure and that's not going to change.","A: My project didn't get the recognition I hoped for. B: Maybe this project wasn't the right one, but you've succeeded before.",Core Belief
341,A: I'm just a failure and always will be.,"A: I didn't get the promotion I worked so hard for... B: That's disappointing, but it wasn't your only chance, right?",Core Belief
342,"A: I just feel so worthless, like I don't matter to anyone.",B: Why do you think you're not getting invited to social events? A: I'm not interesting enough and nobody cares if I'm there or not.,Core Belief
343,"A: Every time I make a mistake, it just confirms I'm not smart enough to do this job.","A: I messed up again at work today on a project... B: No one gets it right all the time, you know?",Intermediate Belief
344,A: I feel like I'm a bad person and I don't deserve to be happy.,"A: I messed up again and let everyone down... B: You're being too hard on yourself, it was a tough situation for anyone.",Core Belief
345,I guess I'm just inherently incapable of being loved,"A: I've had back to back terrible relationships... B: That sounds tough, but remember not every relationship is the same.",Core Belief
346,"It feels like if I make a mistake, I'll be seen as a complete failure",A: My boss has high expectations for this project... B: You always put in your best work though.,Core Belief
347,A: I always mess things up. I’m such a failure.,"A: I'm dreading this project, I never manage to do things right. B: What makes you feel that way about your work?",Automatic Thought
348,A: I can't trust anyone because people are inherently selfish and dishonest.,"A: Every time I confide in someone, I end up regretting it. B: So, you feel like you can't depend on people?",Core Belief
349,"A: If they get to know the real me, they'll lose interest.","A: People seem to like me when we first meet... B: And afterward, how do you feel?",Automatic Thought
350,A: I only got a B on the test because the teacher made it easy this time.,"A: Congratulations on your test result! B: Thanks, but I don't think it really means I understood the material.",Intermediate Belief
351,"A: Every time I try to speak up, I just freeze up. I can't handle it.",A: I want to be more vocal in meetings... B: You seem to have good ideas when we discuss things one-on-one.,Automatic Thought
352,"A: I guess I've always believed that if I don't do everything perfectly, I'm a complete failure.",A: I messed up the report and now I’m sure my boss thinks I'm incompetent... B: Was it a small mistake? Could it be corrected?,Intermediate Belief
353,"A: If I don't get this job, it's because I'm inadequate, not because the job market is tough.","B: Have you heard back from any of the places you applied to? A: No, it's been silence everywhere.",Automatic Thought
354,"A: I feel like if someone doesn't respond to my messages quickly, they must be upset with me.","B: You seemed a bit down lately, what's going on? A: I guess I've just been feeling a bit insecure in my friendships.",Intermediate Belief
355,"A: I always mess things up, just like I did in the project presentation today.","A: I can't believe I froze during the presentation. B: It seemed like a minor hiccup, you were well-prepared.",Automatic Thought
356,A: I feel like I am completely worthless if I'm not the best at my job.,"A: I only got a 'good' rating on my performance review, not 'excellent'. B: But hasn't the feedback been mostly positive?",Core Belief
357,"A: Whenever I start a new project, I can already feel it's going to be a disaster.","A: I just got assigned to lead our next project at work... B: That's great news, congratulations!",Automatic Thought
358,A: I guess I have always seen myself as someone who is not capable of success.,"A: Even when I was a child, I never won at anything... B: Having a few setbacks doesn't define your whole life, though.",Core Belief
359,"A: Every time I get in front of the boss, my mind goes blank and I can't seem to speak properly.",A: The last presentation didn't go so well... B: Maybe you were just nervous?,Automatic Thought
360,A: I seem to always mess up relationships. It must be because I'm just not a lovable person.,"A: Just broke up with my partner, it happened again... B: What makes you think it's something about you?",Intermediate Belief
361,"A: Even when things go right, I'm certain it's just a fluke and not due to my efforts or abilities.",A: I just got praised at work for the project success... B: That's great news! You worked so hard on that.,Automatic Thought
362,"A: Deep down, I really believe I am a total failure and that I'm incapable of accomplishing anything significant.",A: I just feel like nothing I do matters... B: Sounds like you're really doubting your self-worth recently.,Core Belief
363,A: I just can't shake the thought that everyone at the party thought I was awkward and boring.,A: I found it hard to mingle at the party last night... B: Were people unkind to you?,Automatic Thought
364,"A: I feel like if I can't solve this problem, I'm totally useless.","A: Work has been difficult with the complex project... B: But you've handled tough projects before, right?",Automatic Thought
365,"A: When something goes wrong, it feels like it's all my fault.","A: I just couldn't help the team win. B: It was a tough game for everyone, not just you.",Intermediate Belief
366,B: You're late again; you always do this!,"A: Sorry I'm late, the traffic was terrible. B: This seems to happen every time.",Automatic Thought
367,A: I'm such a klutz. I always mess things up.,"B: So you spilled a bit of coffee. It's okay, happens to everyone. A: But that's just it, I always spill things or drop things.",Automatic Thought
368,"A: Every time I speak up in a meeting, I can tell they think my ideas are stupid.","B: Did someone say something about your idea? A: No, but the way they looked at me, I could just tell.",Automatic Thought
369,I always mess things up when I get too close to someone.,A: I’m just not meant to be in relationships... B: That sounds like a strong statement. Have you felt this way before?,Intermediate Belief
370,"Whenever I start a new project, I'm certain I'll fail.",A: I find starting new things so stressful. B: What about starting new things bothers you the most?,Automatic Thought
371,A: I just can't shake the feeling that everyone at work is judging me.,A: I made a small mistake in the report this morning... B: Did anyone say something about it to you?,Automatic Thought
372,A: I see their faces and just know they think I'm incompetent.,"B: So how was your presentation today at work? A: It went fine, but I could feel everyone's eyes on me the whole time.",Automatic Thought
373,A: Everyone must think I'm incompetent.,"A: I messed up in the presentation today... B: It happens, don't be too hard on yourself.",Core Belief
374,"A: I guess I've always felt unwanted, like I just don't belong anywhere.","A: Even as a kid, I was never the one picked for teams... B: That sounds like it was very isolating for you.",Core Belief
