article_number,Current_Turn,Previous_Turns,Type_of_Thought/Belief
870,"A: If I can't answer a question perfectly, then I shouldn't answer at all.",A: I get so nervous when people ask for my opinion... B: You seem to set high standards for yourself when you are put on the spot.,Intermediate Belief
871,A: It's always like this; I make one mistake and it feels like my whole world is crashing down.,"A: I just spilled coffee on my report and now I have to reprint everything... B: That’s frustrating, but these things happen sometimes.",Automatic Thought
872,"A: I don’t think I can ever be truly happy, I’m just not meant for it.",A: I've never been the one to enjoy parties and social gatherings... B: Does that bother you a lot?,Core Belief
873,I always mess things up in the end.,"A: I've completed the project, but I'm not sure about presenting it... B: Why not? You know your material.",Automatic Thought
874,"Everyone always leaves me, I'm just not lovable.","A: My last relationship just ended. B: I'm sorry to hear that, do you know what went wrong?",Core Belief
875,"A: Whenever I speak up in a meeting, I can see that people think my ideas are stupid.",A: I dread every time I need to present at work... B: How come? What goes through your mind?,Automatic Thought
876,"A: I feel like if I'm not the best at what I do, then I'm a complete failure.",A: Everyone at work seems to achieve so much... B: Do you feel pressured to match their achievements?,Intermediate Belief
877,"A: Even when things go well, I can't shake the feeling that it won't last.",A: I managed to get my work done on time yesterday. B: That's great! Sounds like you managed the situation well.,Automatic Thought
878,"A: Deep down, I think that if I make any mistakes, I'm entirely incompetent.","A: I got some feedback on the project, and there were a couple of errors. B: Everyone makes mistakes sometimes, you know?",Core Belief
879,A: They probably just said that to be nice. I'm sure I was terrible.,A: My performance could have been better...B: Your coach gave you a lot of compliments though.,Automatic Thought
880,"A: That's the story of my life, always the runner-up, never first place.",A: I only managed to get second place in the contest again...B: That's still an amazing achievement.,Intermediate Belief
881,"A: Every time I start a task, a voice in my head says, 'You'll never finish this on time.","A: My to-do list just gets longer and longer... B: Sounds stressful, do you prioritize what needs to be done first?",Automatic Thought
882,"A: If I can't trust my best friends, then who can I trust?","A: I just found out my friends made plans without me again... B: Oh no, that must feel very isolating.",Intermediate Belief
883,"A: If I don't get this job, it means I'm incompetent and a failure.","A: I've already been rejected from two interviews… B: Remember, job searching can be a number's game.",Intermediate Belief
884,A: I feel like I'm just a burden to everyone around me.,A: No one ever asks me to hang out anymore... B: Have they been busy? Maybe they're just tied up with their own issues.,Core Belief
885,"A: I feel like if I'm not perfect at work, my boss will think I'm completely incompetent.",A: I've received some minor criticism on my project today... B: Criticism can be hard. How did it make you feel?,Intermediate Belief
886,"A: I'm just destined to be alone forever, nobody ever sticks around.",A: Another relationship came to an end... B: It's tough to go through a breakup. Do you want to talk about it?,Core Belief
887,"A: Even when everyone says it went well, I still feel like something went terribly wrong.","A: I can't shake off the anxiety after work presentations... B: From what I've seen, you always do an excellent job!",Automatic Thought
888,A: My life is a series of mistakes; I feel like I just can’t do anything right.,"A: I messed up the report again, this can't keep happening... B: Everyone makes mistakes, don't be too hard on yourself!",Core Belief
889,"A: Whenever my boss walks by, I just feel like she's thinking I'm not competent.","A: Work's been stressful these days. B: Oh, is it because of the new project?",Automatic Thought
890,"A: I can't help thinking that if I do something wrong, everyone will judge me.",A: Public speaking has always been tough for me. B: But you come across as really confident!,Intermediate Belief
891,A: I'm just going to embarrass myself again like always.,A: The last social event was a disaster. I said all the wrong things. B: It sounds like that experience was very uncomfortable for you.,Intermediate Belief
892,"A: I can't shake the feeling that my colleagues are just tolerating me, that I'm not really part of the team.",A: I always eat lunch alone... B: Have you talked to anyone about this?,Core Belief
893,"A: Every time I talk to him, he just seems disinterested, I must be really boring.",A: I can never manage to hold a conversation with my boss... B: What makes you say that?,Automatic Thought
894,A: Maybe I just don't have what it takes to be successful in this field.,A: I've been passed over for another promotion... B: Do you think it might be due to company politics or something you're doing?,Intermediate Belief
895,"A: Every time someone critiques my work, it feels like they're saying I'm not good enough.",A: I've been having a tough time at work... B: Does the feedback affect you deeply?,Intermediate Belief
896,A: I'm just a failure. I can't seem to do anything right.,"A: This project didn't go as planned... B: You've had projects that went well before, though.",Core Belief
897,"A: Whenever I'm given compliment, I just can't shake the feeling they're not genuine.",A: Getting that praise at work today was nice... B: Sounds like they really appreciate your effort.,Automatic Thought
898,"A: I guess deep down I always believe if I make a mistake, I'm a total failure.","A: I messed up on one part of the project and felt awful about it... B: But overall, the project was a success, right?",Intermediate Belief
899,"A: If I don't get this job, it's evidence that I'm incompetent and can't do anything right.","A: I'm nervous about this interview. B: It's normal to be nervous, but you’re well-qualified for the position!",Intermediate Belief
900,A: Why even try? I'm going to be alone forever. No one could ever really love me.,"A: Another relationship ended. It seems to be a repeating pattern. B: Breakups are tough, but it doesn’t define your future.",Core Belief
901,"A: If he doesn't respond immediately to my texts, it means he doesn't care about me.",A: I'm always anxious when I send a message to my boyfriend... B: Are you worried he won't reply?,Automatic Thought
902,"A: I must always perform perfectly; else, I'm complete failure.","A: Last time I got a B on my test, I felt like I had let everyone down... B: That sounds like you're being hard on yourself.",Core Belief
903,"A: I feel like I always screw things up. The moment I walked into the room, I was convinced I'd say something stupid.",A: Every social event is a nightmare for me. B: Have you felt like this before other events too?,Automatic Thought
904,"A: I guess deep down I believe that if I make any mistakes, I'm a complete failure.","A: I'm so upset with myself, I made an error in the report. B: Everyone makes mistakes sometimes, right?",Intermediate Belief
905,I always mess things up in social situations.,A: I don’t want to go to the party tonight... B: Why not? Is there something specific that's worrying you?,Automatic Thought
906,"I must perform perfectly, or I am a complete failure.","A: I missed one question on the test... B: It's just one question, though. It doesn’t mean you failed the whole test.",Intermediate Belief
907,"A: Whenever I make a small mistake, I feel like it's proof that I can't do anything right.","A: I forgot to send that email last night and now I'm so stressed... B: It happens to everyone, maybe they won't mind.",Automatic Thought
908,"A: Deep down, I’m just an unlovable person. I don’t think anyone could really care about me.",A: I just got dumped... again. B: I'm sorry to hear that. It's been tough for you to find a lasting relationship.,Core Belief
909,A: Everyone must think I'm so incompetent. I can just see it in their eyes.,"A: I messed up during the presentation today. B: It happens, sometimes things don't go as planned.",Automatic Thought
910,"A: I'm always alone because I'm not likable, I've always been this way.","A: Again, I spent my weekend by myself. B: Have you tried reaching out to your friends?",Core Belief
911,"A: If I can't even get this right, I must be completely useless.","A: Aggh, I made such a silly mistake on this report.B: But everyone makes mistakes from time to time.",Automatic Thought
912,A: Why am I always left out? Maybe because I'm just not likable or interesting as a person.,A: They didn't invite me to the outing again this week...B: Has this happened before?,Core Belief
913,A: I just know that they're all going to laugh at me when I give my presentation.,A: I get so nervous when I think about speaking in front of people... B: Have you tried practicing your speech?,Automatic Thought
914,"A: Ultimately, I just feel like I'm unlovable.","A: I've been single for so long, sometimes I wonder why... B: It can take time to find the right person.",Core Belief
915,"A: I just slipped up in that conversation, I'm so awkward around people.",A: I always mess up social interactions. B: What just happened now?,Automatic Thought
916,"A: I have to be in control of everything, otherwise everything goes wrong.","B: Why do you feel so pressured to manage every detail? A: If I don't, I'm convinced it will be a disaster.",Intermediate Belief
917,"A: It's just like everytime something good happens, something bad is sure to follow.","A: I landed a new contract at work today, but I can't shake this bad feeling... B: Why do you think you feel that way?",Automatic Thought
918,A: The thought of going to the party alone makes me anxious because I'm certain I'll say something stupid.,"A: Are you going to Mike's party this Saturday? B: I'm thinking about it, but I'm a bit hesitant.",Intermediate Belief
919,A: It's frustrating because deep down I feel like I don't deserve success.,A: I've been passed over for a promotion again. B: Have you considered that maybe you're not putting yourself out there enough?,Core Belief
920,A: Everyone must be thinking that I'm stupid after that presentation.,"A: I completely blanked during the Q&A session. B: It was a tough crowd, to be honest.",Core Belief
921,"A: I feel so overwhelmed, everyone must think I'm so weak.","A: I couldn't handle the workload today... B: You were just having a rough day, you know.",Automatic Thought
922,A: I always end up alone because I'm unlovable.,"A: Every relationship I've been in has ended badly... B: It's tough to go through breakups, but it's not a reflection of your worth.",Core Belief
923,"I'm just not good at socializing, I'll embarrass myself if I go to the party.","A: Everyone seems excited about the upcoming party... B: You seem hesitant, are you thinking of going?",Automatic Thought
924,"I probably won't get the promotion, I'm not as qualified as others.","A: Have you heard back from the job interview? B: Not yet, but I've been thinking about my chances.",Intermediate Belief
925,I feel like I always mess things up and let everyone down.,"A: I just spilled coffee all over my papers... B: That's unfortunate, but it's just an accident, right?",Automatic Thought
926,I know I’m a complete failure and nothing I do will ever change that.,"A: I didn't get the promotion I worked so hard for... B: That’s disappointing, but it doesn’t reflect your entire career.",Core Belief
927,"A: I guess every time I have to speak publicly, my mind goes blank and I can't think.",A: Presentations at work are the worst for me... B: What happens when you have to present?,Automatic Thought
928,"A: I just believe I'm not that competent, or I wouldn't be so worried about every assignment.",A: The new project is causing me so much stress... B: Do you think you're not ready to handle it?,Intermediate Belief
929,"A: Every time I start a new project, I get this intense feeling that I'm just not good enough to complete it successfully.",A: I've been procrastinating a lot recently... B: What goes through your mind when you think about starting your work?,Automatic Thought
930,"A: I guess being in a relationship is just not in the cards for me, I'm meant to be alone.","A: I've been single for so long, I don't know why... B: Have you had a chance to meet someone you're interested in recently?",Core Belief
931,"A: Every time I get an assignment, I'm overwhelmed with anxiety that it won't be perfect.",A: I have so much on my plate with school right now... B: Have you started working on your projects yet?,Automatic Thought
932,"A: If I can’t succeed in this role, it means I am incompetent at everything.","A: Just got my performance review, and it wasn't great... B: Are the expectations in your job too high perhaps?",Intermediate Belief
933,"Whenever something goes wrong, it's always my fault.",A: I can't believe the project didn't go according to plan... B: But wasn't that out of your control?,Automatic Thought
934,Everything I try is pointless since luck isn't on my side,"A: I missed that job opportunity, even though I was qualified. B: Sometimes these things are just a matter of bad timing.",Intermediate Belief
935,A: I just feel like something will always go wrong.,"A: I keep double-checking my work... B: But you always do a thorough job, don't you?",Automatic Thought
936,A: No one really understands me or cares about what I'm going through.,A: I'm always the odd one out at gatherings... B: You think people perceive you that way?,Core Belief
937,"A: Even when things seem to be going well, I have this nagging feeling that it's going to turn bad very soon.",A: I managed to finish my project on time this week... B: That's great! You must be relieved.,Automatic Thought
938,A: I can't stand being criticized; it feels like they're saying I'm not good enough.,"A: Every time my boss gives me feedback, I get so upset... B: Is the feedback usually harsh?",Intermediate Belief
939,"A: I've always been worthless and unlovable, that's why no relationships work out.",A: Every relationship I've ever been in has ended. B: And how does that make you feel?,Core Belief
940,"A: Deep down, I believe I'm a bad person and that's something that's not going to change.","A: Even when things go right, it feels off. B: Why do you think you feel this way about good situations?",Core Belief
941,"A: Things like this always happen to me, it's like I'm doomed to fail.","A: You won't believe what happened, my car broke down on the way to the interview... B: That's incredibly bad luck to have before an interview.",Automatic Thought
942,"A: I'll never be happy, I always screw things up.","A: I just had a fight with my partner, this always happens when we're trying to have a nice evening... B: Do you believe every disagreement means you're the one ruining the moment?",Core Belief
943,A: I'm so clumsy; I always mess up everything I touch.,A: I can't believe I dropped the glass during dinner. B: It was an accident; anyone could have done that.,Automatic Thought
944,A: I just feel like nobody would care if I wasn't around anymore.,A: No one texted me back when I reached out. B: Maybe they're just busy. People do care about you.,Automatic Thought
945,A: I always mess things up. I'm a total failure in relationships.,"A: My last relationship ended badly, just like the ones before... B: That sounds tough. Do you see any common patterns in how they ended?",Intermediate Belief
946,"A: I feel lost, like I'll never achieve anything worthwhile.",A: I've been passed over for that promotion again... B: You're upset about it; what are you thinking?,Core Belief
947,"A: Even when things go well, I feel like it's just a matter of time before they turn sour again.","A: It seems like every project I work on ends up being more difficult than expected... B: But you successfully resolved the last project issues, right?",Core Belief
948,"A: I understand your advice, but deep down I feel like I'm inherently unloveable.","A: I've been single for a while now and it's getting to me... B: You've been putting yourself out there and meeting new people, which is great!",Core Belief
949,"A: I'm just so stupid, why did I think I could do this.","A: I just gave the wrong answer in the meeting. B: That happens, you can try again next time.",Intermediate Belief
950,"A: Everyone would be better off without me, I'm always a burden.",A: I just can't seem to do anything right. B: You're being too hard on yourself.,Core Belief
951,I always mess things up at the worst possible times.,"A: I'm really worried about handling the presentation next week... B: Last time you said it went well overall, didn't it?",Automatic Thought
952,I should be able to handle these things without getting so worked up.,A: It's just non-stop stress with these deadlines piling up... B: But haven't you been managing your tasks efficiently lately?,Intermediate Belief
953,A: Everyone always leaves me eventually; that's just how my life is.,"A: I don't know, even with friends I feel like I can't make the relationships last... B: Have you experienced a lot of goodbyes?",Core Belief
954,"A: I'm certain if I don't get this right, it means I am a total failure at work.","A: This project is really getting to me, there's so much riding on its success... B: So you're feeling like a lot is at stake with this one?",Core Belief
955,A: I think that I must perform perfectly in every aspect of my work or else I'm a complete failure.,"A: Recently, I've been staying late at work every day. B: Sounds like you've been putting a lot of pressure on yourself.",Intermediate Belief
956,"A: If I don't succeed in this new project, it'll show everyone I can't handle responsibilities.",A: I'm just always worried that I'm not doing enough at work. B: Do you feel like you have to prove your worth?,Intermediate Belief
957,"A: I just know something bad is going to happen if I go on this trip, I can feel it.","A: I've been so worried about this trip coming up... B: Do you have specific concerns, or is it a general feeling of anxiety?",Automatic Thought
958,"A: Every time I make a small mistake at work, I feel like I'm going to be fired. It's like I'm incapable of doing things right.",A: Work has been really stressful lately... B: Has something specific happened to make you feel that way?,Intermediate Belief
959,"A: Whenever I start a new project, I am immediately convinced it will be a disaster.",A: I'm about to start working on the new client's case. B: That sounds like a great opportunity!,Automatic Thought
960,"A: No matter how positive I try to be, I always end up thinking that people are judging me.",A: I started my new yoga class today. B: That’s good. How did it go?,Automatic Thought
961,I just feel like something bad is going to happen today.,A: I've got this weird feeling in my stomach... B: Are you worried about something specific?,Automatic Thought
962,"B: Maybe you're just overthinking things, and you're projecting your stress onto this situation.","A: Everyone seems to get promoted except for me, no matter how hard I work. B: Do you think there might be a reason for this pattern?",Automatic Thought
963,"Every time I make a mistake at work, I feel like I'm going to get fired.",A: I accidentally sent out an email with an error... B: It happens to everyone now and then.,Automatic Thought
964,I just think I'm truly not cut out for handling relationships.,A: I've had another argument with my partner... B: What do you believe is the common theme in these disputes?,Intermediate Belief
965,"I always mess things up, this is going to be another disaster.","A: I just spilled coffee on my presentation notes... B: That's unfortunate, but you can still go on without those notes.",Automatic Thought
966,"I feel like a failure, I'll never be successful in my career.","A: I've been passed over for promotion again... B: That's disappointing, but there may be other opportunities ahead.",Intermediate Belief
967,"A: Every time someone laughs in the office, I feel like they're laughing at me.",A: I can't shake off this nervous feeling at work... B: Are people saying things or is it just a general feeling?,Automatic Thought
968,"A: If I confront my coworker, it will just confirm that I'm an oversensitive person.",A: My coworker made a hurtful joke about me yesterday... B: Have you thought about bringing it up with them?,Intermediate Belief
969,"A: If I don't get this project done on time, my team will think I'm not capable.","A: The deadline for the project is coming up fast, and I am very behind... B: Have you tried asking your team for help?",Intermediate Belief
970,A: I should be able to handle this without getting stressed; I'm an experienced professional.,A: I've been working in this field for over a decade... B: Are the current challenges making you doubt your abilities?,Intermediate Belief
971,"A: I'm such an idiot, I can't believe I messed that up.","A: I made a mistake in my presentation today... B: Don't worry, everyone makes mistakes sometimes.",Automatic Thought
972,"A: If I can't do this job, it's because I am not smart enough.","A: I am struggling with this new project... B: It's okay, it's a complex task, maybe you just need a bit more time to get the hang of it.",Intermediate Belief
973,"A: When things get tough, I usually start thinking I'm not smart enough to figure it out.",A: I just don't know what to do when new challenges come at work... B: Have you dealt with similar situations before?,Intermediate Belief
974,A: I should've seen that coming. I'm always the last one to understand the big picture.,"A: This project update completely caught me off guard... B: You're not alone, it was a surprise for us all.",Core Belief
975,A: I feel so overwhelmed; it's like everything is falling apart the second anything goes wrong.,"A: Today was just the worst, I couldn't get anything done right... B: Was there something specific that happened to trigger that feeling?",Automatic Thought
976,"A: Even when I'm surrounded by friends, I still feel completely alone.","B: Do you often feel lonely, even in social situations? A: Always, like I don't truly belong anywhere.",Core Belief
977,"A: Every time I start a new project, I'm certain it's going to be a total disaster.",A: I just got assigned to lead the next project at work... B: That's great news! Isn't it what you wanted?,Automatic Thought
978,A: Maybe I'm just not meant to be happy.,A: I’ve been feeling down no matter what I do... B: Have there been moments when you felt okay?,Intermediate Belief
979,"A: Every time I start a new project, I feel overwhelmed and convinced it'll turn out terribly.","A: I've got this big project at work, and I'm just stuck... B: What's holding you up?",Automatic Thought
980,"A: I always need to be in control, otherwise everything goes wrong.",A: I get anxious if I'm not the one planning the family gatherings... B: Does it bother you when others take the lead?,Intermediate Belief
981,"A: If I can't even get this right, I must be a total failure at everything.","A: I've been struggling to understand this new part of the project... B: You've solved tough issues before, though.",Intermediate Belief
982,"A: I feel like every time someone is upset, it must be because of something I've done.","B: I noticed you seemed very concerned when Sarah left early today. A: Yeah, I just start thinking if I’m the reason for her mood.",Core Belief
983,"A: Every time I make a mistake, it feels like I'm just worthless.",A: I messed up the presentation today... B: Maybe it wasn't as bad as you think?,Automatic Thought
984,"A: If I can't trust my friends, who can I trust? I guess I'm just not meant to have close relationships.",A: I just found out my friends went out without inviting me... B: Could there be a simple explanation for that?,Intermediate Belief
985,A: I'm convinced everyone at work dislikes me because I got that promotion.,A: I've been getting some weird vibes at work lately... B: What makes you say that?,Automatic Thought
986,"A: If I don't get this job, it means I'm not talented and I'll never be successful.",A: I'm really nervous for the job interview... B: You've got the skills they're looking for.,Intermediate Belief
987,B: Are you suggesting that being perfect is the only way to be happy?,"A: If I make a mistake, everyone will think less of me... A: I just can't shake the feeling that I need to be perfect.",Intermediate Belief
988,A: I guess deep down I feel like I'm not good enough for anyone.,B: Why do you think you put so much pressure on yourself during dates? A: It's just... I always mess things up and it reinforces the idea that I'm a failure.,Core Belief
989,"A: Even when I get a task done on time, I feel like it’s never performed to a high standard.",A: I keep pushing myself to work harder... B: It sounds like you always demand the best from yourself.,Intermediate Belief
990,"A: Whenever someone else takes the lead, I feel like I’m being judged on my own abilities.",A: I prefer to be in control of projects at work... B: Is it difficult for you to let others take charge?,Intermediate Belief
991,"A: Suddenly, my heart starts racing and I think 'I am going to have a panic attack.'",B: What happens when you have to speak in front of the group? A: It's terrifying.,Automatic Thought
992,"A: I just feel worthless, like I'm a failure at everything.","B: You seem very harsh on yourself, why is that? A: I've never met my own expectations.",Core Belief
